{
  "schema_version": "local-openshell-gateways/v1",
  "observed_at": "2026-09-23T02:10:47.971458854Z",
  "state": "available",
  "items": [
    {
      "gateway_id": "og-b2c81e49a8686d6203297726dbcc0f8c",
      "name": "registered",
      "endpoint_display": "https://127.0.0.1:17671",
      "native_active": true,
      "configuration_fingerprint": "c1eb9147ddc4362034c5bf68dd68b1d7aa87cc0f09b67d604a51c504540d6fa0"
    }
  ],
  "started_gateway": false,
  "changed_native_selection": false
}
